<?xml version="1.0" encoding="UTF-8"?>
<code xmlns:xsi="http://www.w3.org/2001/XMLSchema-instance"
	xmlns="http://polaris.pivoto.cn/schema/code" xsi:schemaLocation="http://polaris.pivoto.cn/schema/code code.xsd" >
	<!--
	属性优先级: 表属性 > 模板属性 > 组属性 > 全局属性
	-->
	<!-- outdir: 配置生成代码的位置 -->
	<outdir>./target/code</outdir>
	<!-- 需忽略的表名前缀，多个间逗号分隔 -->
	<table-prefix>_,t_,tbl_</table-prefix>
	<!-- 需忽略的表名后缀，多个间逗号分隔 -->
	<table-suffix>_,_bak,_tmp</table-suffix>
	<!-- 需忽略的列名前缀，多个间逗号分隔 -->
	<column-prefix>_</column-prefix>
	<!-- 需忽略的列名后缀，多个间逗号分隔 -->
	<column-suffix>_</column-suffix>
	<mappings>
		<mapping jdbcType="VARCHAR" javaType="java.lang.String" />
	</mappings>
	<!-- 扩展属性配置 -->
	<property>
		<!-- 扩展属性配置 -->
		<entry key="author" value="Qt"/>
		<entry key="useGeneratedKeys" value="true"/>
		<entry key="srcDir" value="src/main/java"/>
		<entry key="webDir" value="src/main/resources/META-INF/resources"/>
		<entry key="entityPackage" value="entity"/>
		<entry key="mapperPackage" value="mapper"/>
		<entry key="servicePackage" value="service"/>
		<entry key="implPackage" value="impl"/>
		<entry key="controllerPackage" value="controller"/>
	</property>

	<!-- 可配置多个组以使用不同的配置 -->
	<groups>
		<!-- 代码生成配置组 -->
		<group>
			<!-- 扩展属性配置 -->
			<property></property>
			<!-- 模板配置 -->
			<templates>
				<!-- 模板配置 -->
				<template>
					<!-- 扩展属性配置 -->
					<property></property>
					<!-- 模板路径 -->
					<path>/vm/example.txt.vm</path>
					<!-- 输出的相对路径 -->
					<dirname>//</dirname>
					<!-- 输出文件名 -->
					<filename>${table.javaClassName}.example.txt</filename>
				</template>
				<template>
					<property></property>
					<path>/vm/java/base/entity/Entity.java.vm</path>
					<dirname>${env.srcDir}/${table.javaPackageDir}/${env.entityPackage}</dirname>
					<filename>${table.javaClassName}Entity.java</filename>
				</template>
				<template>
					<property></property>
					<path>/vm/java/base/mapper/Mapper.java.vm</path>
					<dirname>${env.srcDir}/${table.javaPackageDir}/${env.mapperPackage}</dirname>
					<filename>${table.javaClassName}Mapper.java</filename>
				</template>
				<template>
					<property></property>
					<path>/vm/resources/Mapper.xml.vm</path>
					<dirname>${env.srcDir}/${table.javaPackageDir}/${env.mapperPackage}</dirname>
					<filename>${table.javaClassName}Mapper.xml</filename>
				</template>
				<template>
					<property></property>
					<path>/vm/java/base/service/Service.java.vm</path>
					<dirname>${env.srcDir}/${table.javaPackageDir}/${env.servicePackage}</dirname>
					<filename>${table.javaClassName}Service.java</filename>
				</template>
				<template>
					<property></property>
					<path>/vm/java/base/service/IService.java.vm</path>
					<dirname>${env.srcDir}/${table.javaPackageDir}/${env.servicePackage}</dirname>
					<filename>I${table.javaClassName}Service.java</filename>
				</template>
				<template>
					<property></property>
					<path>/vm/java/base/service/ServiceImpl.java.vm</path>
					<dirname>${env.srcDir}/${table.javaPackageDir}/${env.servicePackage}/${env.implPackage}</dirname>
					<filename>${table.javaClassName}ServiceImpl.java</filename>
				</template>
				<template>
					<property></property>
					<path>/vm/java/facade/controller/Controller.java.vm</path>
					<dirname>${env.srcDir}/${table.javaPackageDir}/${env.controllerPackage}</dirname>
					<filename>${table.javaClassName}Controller.java</filename>
				</template>
			</templates>
			<tables>
				<table catalog="" schema="BASESV" name="ARM_BCH" package="io.polaris.app">
					<property></property>
				</table>
				<table catalog="" schema="BASESV" name="ARM_USER" package="io.polaris.app">
					<property></property>
				</table>
			</tables>

		</group>
		<group>
			<property></property>
		</group>
	</groups>
</code>
